{
  "schemaVersion": 1,
  "artifactKind": "server-route-bundle-object-acquisition-contract-v1",
  "issueRef": "AquilaXk/easysubway-platform#60",
  "producer": {
    "repository": "AquilaXk/easysubway-data",
    "gitSha": "2b1390c1c764fde10b9da8ca8015a9252e5342fb",
    "schemas": [
      {
        "role": "consumer-handoff",
        "path": "contracts/datapack/server-route-bundle-consumer-handoff.schema.json",
        "gitBlob": "b88c86f353310cd119ebb3fb0d76a4cc27251cb7",
        "rawSha256": "9a6e691a8e029c21075a93f7da2b409ae5a0cde2d7bb8e02ff9c393157657d36"
      },
      {
        "role": "publication-receipt",
        "path": "contracts/datapack/server-route-bundle-publication-receipt.schema.json",
        "gitBlob": "98395dc2928dc818b8b409b65c1ed1e19af9b9da",
        "rawSha256": "79c2396c383461dc45b6503ccd3b85bdbf3fc64183e31042f09c92c84db44d3e"
      },
      {
        "role": "component-manifest",
        "path": "contracts/datapack/artifact-component-manifest.schema.json",
        "gitBlob": "7ff2141895446876aeeaccd85d3bd7b2634f9c42",
        "rawSha256": "64995e377b45aa86ff7dbd9635dd8248315bc74134040da6ff42ae82ed05c20b"
      }
    ]
  },
  "consumedJsonPointers": [
    "/publicationReceipt/repository/gitSha",
    "/publicationReceipt/candidate",
    "/publicationReceipt/locator",
    "/publicationReceipt/objects",
    "/release",
    "/platformRelease/serverRouteBundleDigest",
    "/handoffSha256"
  ],
  "acquisition": {
    "inventoryPointer": "/publicationReceipt/objects",
    "objectCount": 8,
    "objectIdentityFields": ["objectKey", "sizeBytes", "sha256"],
    "transport": {
      "scheme": "HTTPS",
      "redirectsAllowed": false,
      "locatorPointer": "/publicationReceipt/locator",
      "objectPrefixPolicy": "EXACT_RECEIPT_PREFIX_AND_KEY"
    },
    "rejectConditions": [
      "MISSING_OR_UNKNOWN_FIELD",
      "DUPLICATE_OR_REORDERED_OBJECT",
      "OBJECT_KEY_OR_PREFIX_MISMATCH",
      "EMPTY_PARTIAL_OR_OVERSIZED_OBJECT",
      "SIZE_OR_SHA256_MISMATCH",
      "TRANSPORT_INTERRUPTED",
      "CHANGED_SECOND_READ",
      "PATH_TRAVERSAL",
      "SYMLINK_OUTPUT"
    ]
  },
  "candidateOutput": {
    "ownership": "TASK_OWNED",
    "overwriteAllowed": false,
    "visibility": "AFTER_ALL_OBJECTS_AND_HANDOFF_IDENTITIES_VALIDATE",
    "partialOutputOnFailure": 0
  },
  "retention": {
    "protectedTargets": ["ACTIVE", "EXPLICIT_VALIDATED_ROLLBACK"],
    "currentObjectUnavailableAction": "TYPED_NONZERO_FAILURE",
    "forbiddenAlternateSources": ["OLDER_OBJECT", "LOCAL_CACHE", "HUB_SOURCE", "PREVIOUS_ARTIFACT"],
    "alternateSelectionCount": 0
  },
  "failure": {
    "result": "TYPED_NONZERO",
    "codes": [
      "HANDOFF_SHAPE_INVALID",
      "PRODUCER_IDENTITY_MISMATCH",
      "INVENTORY_INVALID",
      "LOCATOR_POLICY_VIOLATION",
      "OBJECT_IDENTITY_MISMATCH",
      "OBJECT_READ_UNSTABLE",
      "OUTPUT_POLICY_VIOLATION",
      "RETENTION_TARGET_PROTECTED",
      "CURRENT_OBJECT_UNAVAILABLE"
    ],
    "stateMutationOnFailure": { "candidate": 0, "active": 0, "traffic": 0 },
    "alternateInvocationCount": 0
  }
}
